{
  "$schema": "../schemas/preset.schema.json",
  "id": "marketing-editorial",
  "name": "marketing / editorial",
  "version": "0.1.0",
  "bestFor": [
    "landing pages",
    "storytelling pages",
    "launches",
    "brand surfaces",
    "case studies",
    "product narratives",
    "campaigns"
  ],
  "activates": [
    "design-review",
    "ux-baseline-check",
    "ui-polish-pass",
    "agent-friendly-design when shipping to production",
    "responsive.md",
    "anti-patterns.md",
    "whimsical-design when personality is requested",
    "world-build when immersion is requested",
    "web-animation-design when motion is part of the concept"
  ],
  "skips": [
    "dense utilitarian defaults as the main aesthetic unless the brief mixes modes"
  ],
  "designPosture": [
    "identity-forward",
    "atmosphere matters",
    "rhythm and pacing matter as much as correctness",
    "responsive behavior should preserve the story, not just the layout"
  ],
  "qualityBar": [
    "the page has a point of view",
    "sections have varied rhythm and visual weight",
    "motion, if present, feels purposeful and interruptible",
    "mobile gets its own thoughtful translation when needed",
    "the work feels designed, not merely assembled"
  ],
  "recommendedInputs": [
    "visual references or brand cues",
    "desired emotional register",
    "hero message and conversion goal",
    "asset direction: imagery, illustration, motion, typography",
    "DESIGN.md or project identity notes with atmosphere language"
  ],
  "humanJudgmentRequired": [
    "whether the concept is actually distinctive or just louder",
    "when motion improves the story vs distracts from it",
    "how far to push personality before usability suffers",
    "what should change completely on mobile to preserve impact"
  ],
  "promptFraming": [
    "build a page with a strong editorial point of view",
    "treat spacing and rhythm as part of the message",
    "make the mobile version preserve the emotional arc, not just the blocks",
    "avoid generic saas gradients and stock launch-page tropes"
  ],
  "runReportDefaults": {
    "taskClassification": [
      "marketing page",
      "editorial surface",
      "storytelling UI",
      "launch page"
    ],
    "skillsFired": [
      "design-review",
      "ux-baseline-check",
      "ui-polish-pass",
      "whimsical-design, world-build, or web-animation-design only when the brief earns them"
    ],
    "skillsSkipped": [
      "dense utilitarian defaults unless the brief mixes modes"
    ],
    "referencesConsulted": [
      "spacing.md",
      "typography.md",
      "anti-patterns.md",
      "responsive.md",
      "creative references as needed"
    ],
    "issuesDetected": [
      "generic saas tropes",
      "weak visual rhythm",
      "atmosphere collapse on mobile",
      "decorative motion without purpose",
      "loudness without point of view"
    ],
    "fixesApplied": [
      "stronger composition",
      "clearer atmosphere",
      "better section pacing",
      "more intentional responsive translation",
      "tighter motion use"
    ],
    "humanJudgment": [
      "whether the concept has a real point of view",
      "how far expression should be pushed"
    ]
  }
}